{
  "schema_version": "1.0.0",
  "id": "inventory-2025-ai-sme",
  "commitment_id": "AI_SME_ADOPTION",
  "chapter": {
    "title": "2025 G7 Final Compliance Report: Artificial Intelligence for SMEs",
    "uri": "https://www.g7.utoronto.ca/evaluations/2025compliance-final/04-2025-G7-final-compliance-ai.pdf",
    "report_year": 2025,
    "page_range": "chapter pages 1-?",
    "content_hash": "sha256:0000000000000000000000000000000000000000000000000000000000000000"
  },
  "subjects": [
    "Canada",
    "France",
    "Germany",
    "Italy",
    "Japan",
    "UnitedKingdom",
    "UnitedStates",
    "EuropeanUnion"
  ],
  "evaluation_window": {
    "start": "2025-06-18",
    "end": "2026-06-01"
  },
  "commitment_text": "Sustain investments in AI adoption programs for SMEs, including support for access to compute and digital infrastructure.",
  "definitions": [
    {
      "term": "sustain",
      "definition": "Continuation of support during the evaluation period."
    },
    {
      "term": "access",
      "definition": "Reachability, affordability, acceptability, and sufficient quality."
    }
  ],
  "classifications": [
    {
      "label": "strong",
      "description": "Implemented or funded action directly supporting SME AI adoption."
    },
    {
      "label": "weak",
      "description": "Indirect, preliminary, short-term, or general AI support."
    },
    {
      "label": "counter",
      "description": "Action obstructing SME AI adoption."
    }
  ],
  "dimensions": [],
  "goals": [],
  "partner_classes": [],
  "required_artifacts": [],
  "temporal_conditions": [
    "Actions are evaluated in the summit-to-summit period."
  ],
  "attribution_conditions": [
    "National and collective action require an explicit attribution policy."
  ],
  "identity_conditions": [
    "Announcements and outputs from one underlying instrument may be duplicates."
  ],
  "exclusions": [
    "General AI measures without meaningful SME targeting may be weak or excluded."
  ],
  "score_guideline": {
    "prose": "Two or fewer weak actions or countervailing conduct yields -1; three or four weak actions or up to four strong actions yields 0; five or more strong actions yields +1.",
    "normalized_branches": [
      {
        "result": "-1",
        "condition_text": "counter_exists OR (strong_count = 0 AND weak_count <= 2)"
      },
      {
        "result": "0",
        "condition_text": "1 <= strong_count <= 4 OR (strong_count = 0 AND 3 <= weak_count <= 4)"
      },
      {
        "result": "+1",
        "condition_text": "strong_count >= 5"
      }
    ]
  },
  "observed_results": {
    "Canada": "+1",
    "France": "+1",
    "Germany": "+1",
    "Italy": "+1",
    "Japan": "0",
    "UnitedKingdom": "+1",
    "UnitedStates": "0",
    "EuropeanUnion": "+1"
  },
  "open_questions": [
    {
      "id": "q-many-weak",
      "question": "Does “up to four strong actions” mean zero through four or one through four, and what follows for zero-strong cases?",
      "category": "rule_gap",
      "blocking": true,
      "proposed_resolution": "Preserve both normalizations as scenarios. The one-to-four reading produces a five-or-more-weak gap; the zero-to-four reading overlaps non-compliance at low weak counts. Resolve only in a named profile."
    },
    {
      "id": "q-counter-precedence",
      "question": "Does one counteraction override five or more strong actions?",
      "category": "rule_overlap",
      "blocking": true,
      "proposed_resolution": "Make precedence a profile parameter."
    }
  ],
  "review_status": "extracted",
  "reviewer_ids": [],
  "notes": "This inventory is a planning fixture and should be checked against page-anchored source text before approval."
}
